{
  "schema": "afi.analyst-input-envelope.v1",
  "signalId": "sig-d2-20260115-000123",
  "providerId": "prov-telegram-alpha",
  "analystId": "analyst-uwr-01",
  "strategyId": "trend-pullback",
  "strategyViewType": "trend-pullback-local-view",
  "enrichedViewSchemaRef": "strategy://trend-pullback/enriched-view.schema.json#v1",
  "strategyLocalView": {
    "momentumState": "pullback-in-uptrend",
    "pullbackDepthPct": 3.2,
    "emaStack": {
      "fastAboveSlow": true,
      "slope": "rising"
    },
    "strategyInternal": {
      "scratchScore": 0.63,
      "candidateRank": 2
    }
  },
  "strategyLocalViewHash": {
    "algorithm": "sha256",
    "canonicalizationVersion": "afi.hash.v1",
    "domainTag": "afi.d2.strategy-local-view",
    "value": "2e7d2c03a9507ae265ecf5b5356885a53393a2029d241394997265a1a25aefc6"
  },
  "sourceDisclosureProfiles": [
    {
      "sourceId": "src-exchange-blofin-api",
      "sourceClass": "exchange-api",
      "disclosureLevel": "partial",
      "withheldReason": "license-restricted",
      "licenseConstraint": "no-redistribution",
      "replayabilityLevel": "pinned-inputs",
      "providerAttestation": "self-attested",
      "analystVisibleSummary": "Blofin perp market data API; OHLCV and depth snapshots available at 15m granularity."
    }
  ],
  "evidenceRefs": [
    {
      "evidenceId": "ev-price-context-000123-001",
      "sourceRef": "src-exchange-blofin-api",
      "evidenceHash": {
        "algorithm": "sha256",
        "canonicalizationVersion": "afi.hash.v1",
        "domainTag": "afi.d2.evidence",
        "value": "ca978112ca1bbdcafac231b39a23dc4da786eff8147c4e72b9807785afee48bb"
      },
      "fetchedAt": "2026-01-15T12:00:05Z",
      "asOf": "2026-01-15T12:00:00Z",
      "redactionStatus": "disclosed"
    }
  ],
  "replayProfileRef": "replay-profile:sig-d2-20260115-000123"
}
